{
 "meta": {
  "lang": "ar",
  "dir": "rtl"
 },
 "basics": {
  "name": "سارة اختبار",
  "headline": "أخصائية دعم العملاء",
  "email": "sara.test@example.com",
  "phone": "+964 750 000 0000",
  "location": "أربيل، العراق",
  "links": [
   {
    "label": "LinkedIn",
    "url": "linkedin.com/in/sara-test-example"
   }
  ]
 },
 "summary": "أخصائية دعم عملاء بخبرة ثلاث سنوات في معالجة طلبات الدردشة والهاتف لمتجر إلكترونيات إلكتروني. أجيد استخدام أنظمة إدارة العملاء (CRM) وشرح المشكلات التقنية بلغة بسيطة.",
 "highlights": [
  {
   "value": "~40",
   "label": "طلبًا يوميًا (تقدير ذاتي)"
  },
  {
   "value": "12",
   "label": "إجابة في مركز المساعدة"
  },
  {
   "value": "3",
   "label": "موظفين جدد تم تدريبهم"
  }
 ],
 "work": [
  {
   "title": "موظفة دعم العملاء",
   "org": "شركة المثال للإلكترونيات",
   "location": "أربيل",
   "start": "2022-03",
   "end": "حتى الآن",
   "bullets": [
    "معالجة نحو 40 طلبًا يوميًا عبر الدردشة والهاتف بخصوص الضمان والتوصيل (تقدير ذاتي).",
    "كتابة 12 إجابة في مركز المساعدة لأكثر أسئلة الضمان تكرارًا.",
    "تدريب 3 موظفين جدد على نظام التذاكر Zendesk خلال شهرهم الأول."
   ]
  },
  {
   "title": "موظفة مركز اتصال",
   "org": "خدمات الاتصالات النموذجية",
   "location": "أربيل",
   "start": "2020-06",
   "end": "2022-02",
   "bullets": [
    "الرد على مكالمات الفواتير الواردة وتسجيل كل حالة في نظام CRM.",
    "تقدير من قائد الفريق لأدنى معدل مكالمات متكررة في المناوبة (الربع الثالث 2021)."
   ]
  }
 ],
 "education": [
  {
   "title": "بكالوريوس علوم الحاسوب",
   "org": "جامعة المثال",
   "location": "أربيل",
   "start": "2019",
   "end": "2023"
  }
 ],
 "skills": [
  {
   "name": "الأدوات",
   "items": [
    "Zendesk",
    "Excel",
    "Google Workspace"
   ]
  },
  {
   "name": "نقاط القوة",
   "items": [
    "الدعم الكتابي",
    "تهدئة الموقف",
    "معرفة المنتجات"
   ]
  }
 ],
 "languages": [
  {
   "name": "العربية",
   "level": "لغة أم"
  },
  {
   "name": "الكردية (سورانية)",
   "level": "لغة أم"
  },
  {
   "name": "الإنجليزية",
   "level": "C1"
  }
 ]
}